{
  "pageId": "page-1",
  "title": "Runtime coverage",
  "meta": {
    "author": "nexgen",
    "wordCount": 42
  },
  "blocks": [
    {
      "blockId": "block-1",
      "order": 0,
      "text": "hello",
      "style": {
        "bold": true,
        "indent": 1
      },
      "page": null
    }
  ]
}
